{
  "$schema": "https://json-schema.org/draft/2020-12/schema",
  "$id": "https://stegverse.org/schemas/execution-attempt-journal.schema.json",
  "title": "Governed Execution Attempt Journal",
  "type": "object",
  "additionalProperties": false,
  "required": [
    "schema_version",
    "journal_id",
    "envelope_id",
    "envelope_sha256",
    "idempotency_key",
    "state",
    "revision",
    "lease",
    "events",
    "authority_note"
  ],
  "properties": {
    "schema_version": {"const": "0.1"},
    "journal_id": {"type": "string", "minLength": 1},
    "envelope_id": {"type": "string", "minLength": 1},
    "envelope_sha256": {"type": "string", "pattern": "^[a-f0-9]{64}$"},
    "idempotency_key": {"type": "string", "minLength": 1},
    "state": {"enum": ["STARTED", "DISPATCHED", "OBSERVING", "TERMINAL", "ABANDONED"]},
    "revision": {"type": "integer", "minimum": 0},
    "lease": {
      "type": "object",
      "additionalProperties": false,
      "required": ["owner", "acquired_at", "expires_at"],
      "properties": {
        "owner": {"type": "string", "minLength": 1},
        "acquired_at": {"type": "string", "format": "date-time"},
        "expires_at": {"type": "string", "format": "date-time"}
      }
    },
    "events": {
      "type": "array",
      "minItems": 1,
      "items": {
        "type": "object",
        "additionalProperties": false,
        "required": ["sequence", "event", "recorded_at", "actor", "receipt_sha256"],
        "properties": {
          "sequence": {"type": "integer", "minimum": 0},
          "event": {"enum": ["ATTEMPT_STARTED", "DISPATCH_RECORDED", "OBSERVATION_STARTED", "RESULT_ATTACHED", "RECOVERY_DECIDED", "ATTEMPT_ABANDONED"]},
          "recorded_at": {"type": "string", "format": "date-time"},
          "actor": {"type": "string", "minLength": 1},
          "receipt_sha256": {"type": "string", "pattern": "^[a-f0-9]{64}$"}
        }
      }
    },
    "terminal_receipt_ref": {"type": ["string", "null"]},
    "authority_note": {"const": "Recovery restores execution state only; it does not grant or expand authority."}
  }
}
